{
  "schema_version": 1,
  "captured_at": "2026-07-10T12:35:09.567897+00:00",
  "queries": [
    "created:>=2026-06-26 stars:>=25 archived:false fork:false",
    "pushed:>=2026-07-03 stars:>=500 archived:false fork:false",
    "topic:productivity pushed:>=2026-07-03 stars:>=50 archived:false fork:false",
    "topic:artificial-intelligence pushed:>=2026-07-03 stars:>=100 archived:false fork:false",
    "topic:developer-tools pushed:>=2026-07-03 stars:>=100 archived:false fork:false",
    "topic:self-hosted pushed:>=2026-07-03 stars:>=100 archived:false fork:false"
  ],
  "count": 166,
  "repositories": [
    {
      "repo": "freeCodeCamp/freeCodeCamp",
      "url": "https://github.com/freeCodeCamp/freeCodeCamp",
      "description": "freeCodeCamp.org's open-source codebase and curriculum. Learn math, programming, and computer science for free.",
      "owner": "freeCodeCamp",
      "language": "TypeScript",
      "license": "BSD-3-Clause",
      "topics": [
        "careers",
        "certification",
        "community",
        "curriculum",
        "d3",
        "education",
        "freecodecamp",
        "javascript",
        "learn-to-code",
        "math",
        "nodejs",
        "nonprofits",
        "programming",
        "react",
        "teachers"
      ],
      "stars": 451518,
      "forks": 45542,
      "open_issues": 217,
      "created_at": "2014-12-24T17:49:19Z",
      "updated_at": "2026-07-10T12:17:01Z",
      "pushed_at": "2026-07-10T11:46:44Z",
      "default_branch": "main",
      "captured_at": "2026-07-10T12:35:09.567897+00:00",
      "candidate_query": "pushed:>=2026-07-03 stars:>=500 archived:false fork:false",
      "analysis_state": "pending"
    },
    {
      "repo": "EbookFoundation/free-programming-books",
      "url": "https://github.com/EbookFoundation/free-programming-books",
      "description": ":books: Freely available programming books",
      "owner": "EbookFoundation",
      "language": "Python",
      "license": "CC-BY-4.0",
      "topics": [
        "books",
        "education",
        "hacktoberfest",
        "list",
        "resource"
      ],
      "stars": 391582,
      "forks": 66497,
      "open_issues": 76,
      "created_at": "2013-10-11T06:50:37Z",
      "updated_at": "2026-07-10T12:20:02Z",
      "pushed_at": "2026-07-04T21:45:40Z",
      "default_branch": "main",
      "captured_at": "2026-07-10T12:35:09.567897+00:00",
      "candidate_query": "pushed:>=2026-07-03 stars:>=500 archived:false fork:false",
      "analysis_state": "pending"
    },
    {
      "repo": "openclaw/openclaw",
      "url": "https://github.com/openclaw/openclaw",
      "description": "Your own personal AI assistant. Any OS. Any Platform. The lobster way. 🦞 ",
      "owner": "openclaw",
      "language": "TypeScript",
      "license": "NOASSERTION",
      "topics": [
        "ai",
        "assistant",
        "crustacean",
        "molty",
        "openclaw",
        "own-your-data",
        "personal"
      ],
      "stars": 382452,
      "forks": 80251,
      "open_issues": 6329,
      "created_at": "2025-11-24T10:16:47Z",
      "updated_at": "2026-07-10T12:32:54Z",
      "pushed_at": "2026-07-10T12:34:07Z",
      "default_branch": "main",
      "captured_at": "2026-07-10T12:35:09.567897+00:00",
      "candidate_query": "pushed:>=2026-07-03 stars:>=500 archived:false fork:false",
      "analysis_state": "pending"
    },
    {
      "repo": "nilbuild/developer-roadmap",
      "url": "https://github.com/nilbuild/developer-roadmap",
      "description": "Interactive roadmaps, guides and other educational content to help developers grow in their careers.",
      "owner": "nilbuild",
      "language": "TypeScript",
      "license": "NOASSERTION",
      "topics": [
        "angular-roadmap",
        "backend-roadmap",
        "blockchain-roadmap",
        "computer-science",
        "dba-roadmap",
        "developer-roadmap",
        "devops-roadmap",
        "frontend-roadmap",
        "go-roadmap",
        "java-roadmap",
        "javascript-roadmap",
        "nodejs-roadmap",
        "python-roadmap",
        "qa-roadmap",
        "react-roadmap",
        "roadmap",
        "software-architect-roadmap",
        "vue-roadmap"
      ],
      "stars": 360151,
      "forks": 44440,
      "open_issues": 23,
      "created_at": "2017-03-15T13:45:52Z",
      "updated_at": "2026-07-10T12:26:18Z",
      "pushed_at": "2026-07-10T08:23:45Z",
      "default_branch": "master",
      "captured_at": "2026-07-10T12:35:09.567897+00:00",
      "candidate_query": "pushed:>=2026-07-03 stars:>=500 archived:false fork:false",
      "analysis_state": "pending"
    },
    {
      "repo": "vinta/awesome-python",
      "url": "https://github.com/vinta/awesome-python",
      "description": "An opinionated list of Python frameworks, libraries, tools, and resources",
      "owner": "vinta",
      "language": "Python",
      "license": "NOASSERTION",
      "topics": [
        "awesome",
        "collections",
        "python",
        "python-frameworks",
        "python-libraries",
        "python-tools"
      ],
      "stars": 307370,
      "forks": 28248,
      "open_issues": 18,
      "created_at": "2014-06-27T21:00:06Z",
      "updated_at": "2026-07-10T12:27:58Z",
      "pushed_at": "2026-07-08T09:29:27Z",
      "default_branch": "master",
      "captured_at": "2026-07-10T12:35:09.567897+00:00",
      "candidate_query": "pushed:>=2026-07-03 stars:>=500 archived:false fork:false",
      "analysis_state": "pending"
    },
    {
      "repo": "awesome-selfhosted/awesome-selfhosted",
      "url": "https://github.com/awesome-selfhosted/awesome-selfhosted",
      "description": "A list of Free Software network services and web applications which can be hosted on your own servers",
      "owner": "awesome-selfhosted",
      "language": null,
      "license": "NOASSERTION",
      "topics": [
        "awesome",
        "awesome-list",
        "cloud",
        "free-software",
        "hosting",
        "privacy",
        "self-hosted",
        "selfhosted"
      ],
      "stars": 304314,
      "forks": 14228,
      "open_issues": 0,
      "created_at": "2015-06-01T02:33:17Z",
      "updated_at": "2026-07-10T12:15:44Z",
      "pushed_at": "2026-07-09T15:58:47Z",
      "default_branch": "master",
      "captured_at": "2026-07-10T12:35:09.567897+00:00",
      "candidate_query": "pushed:>=2026-07-03 stars:>=500 archived:false fork:false | topic:self-hosted pushed:>=2026-07-03 stars:>=100 archived:false fork:false",
      "analysis_state": "pending"
    },
    {
      "repo": "practical-tutorials/project-based-learning",
      "url": "https://github.com/practical-tutorials/project-based-learning",
      "description": "Curated list of project-based tutorials",
      "owner": "practical-tutorials",
      "language": "Python",
      "license": "MIT",
      "topics": [
        "beginner-project",
        "cpp",
        "golang",
        "javascript",
        "project",
        "python",
        "tutorial",
        "webdevelopment"
      ],
      "stars": 272722,
      "forks": 35199,
      "open_issues": 283,
      "created_at": "2017-04-12T05:07:46Z",
      "updated_at": "2026-07-10T12:26:38Z",
      "pushed_at": "2026-07-06T11:21:27Z",
      "default_branch": "master",
      "captured_at": "2026-07-10T12:35:09.567897+00:00",
      "candidate_query": "pushed:>=2026-07-03 stars:>=500 archived:false fork:false",
      "analysis_state": "pending"
    },
    {
      "repo": "obra/superpowers",
      "url": "https://github.com/obra/superpowers",
      "description": "An agentic skills framework & software development methodology that works.",
      "owner": "obra",
      "language": "Shell",
      "license": "MIT",
      "topics": [
        "ai",
        "brainstorming",
        "coding",
        "obra",
        "sdlc",
        "skills",
        "subagent-driven-development",
        "superpowers"
      ],
      "stars": 251457,
      "forks": 22438,
      "open_issues": 310,
      "created_at": "2025-10-09T19:45:18Z",
      "updated_at": "2026-07-10T12:35:06Z",
      "pushed_at": "2026-07-06T21:53:36Z",
      "default_branch": "main",
      "captured_at": "2026-07-10T12:35:09.567897+00:00",
      "candidate_query": "pushed:>=2026-07-03 stars:>=500 archived:false fork:false",
      "analysis_state": "pending"
    },
    {
      "repo": "react/react",
      "url": "https://github.com/react/react",
      "description": "The library for web and native user interfaces.",
      "owner": "react",
      "language": "JavaScript",
      "license": "MIT",
      "topics": [
        "declarative",
        "frontend",
        "javascript",
        "library",
        "react",
        "ui"
      ],
      "stars": 246366,
      "forks": 51167,
      "open_issues": 1204,
      "created_at": "2013-05-24T16:15:54Z",
      "updated_at": "2026-07-10T12:20:15Z",
      "pushed_at": "2026-07-10T03:04:54Z",
      "default_branch": "main",
      "captured_at": "2026-07-10T12:35:09.567897+00:00",
      "candidate_query": "pushed:>=2026-07-03 stars:>=500 archived:false fork:false",
      "analysis_state": "pending"
    },
    {
      "repo": "torvalds/linux",
      "url": "https://github.com/torvalds/linux",
      "description": "Linux kernel source tree",
      "owner": "torvalds",
      "language": "C",
      "license": "NOASSERTION",
      "topics": [],
      "stars": 239085,
      "forks": 63333,
      "open_issues": 3,
      "created_at": "2011-09-04T22:48:12Z",
      "updated_at": "2026-07-10T12:32:46Z",
      "pushed_at": "2026-07-09T23:45:38Z",
      "default_branch": "master",
      "captured_at": "2026-07-10T12:35:09.567897+00:00",